From Prediction to PRO-Diction Models: Incorporating Patient-Reported Outcomes Into ...	https://dailynews.ascopubs.org/do/prediction-pro-diction-models-incorporating-patient-reported-outcomes-into-predictive
Patient-Reported Outcome Measures Used to Assess Surgical Interventions for Pelvic Organ ...	https://www.urotoday.com/recent-abstracts/pelvic-health-reconstruction/pelvic-prolapse/163406-patient-reported-outcome-measures-used-to-assess-surgical-interventions-for-pelvic-organ-prolapse-stress-urinary-incontinence-and-mesh-complications-a-scoping-review-for-the-development-of-the-appraise-prom.html
PROs vs clinician-reported adverse events in a large clinical trial: findings from the phase 3 ...	https://ashpublications.org/blood/article/doi/10.1182/blood.2025028848/547473/PROs-vs-clinician-reported-adverse-events-in-a
Standardizing patient-reported outcomes across diseases: development of a novel generic ...	https://www.frontiersin.org/articles/10.3389/frhs.2025.1497055/full
Comparative Analysis of Patient Reported Outcome at 1 Year after Bridge Enhanced ACL ...	https://pmc.ncbi.nlm.nih.gov/articles/PMC12475716/
Patient‐Reported Outcome Measures Used to Assess Surgical Interventions for Pelvic ...	https://obgyn.onlinelibrary.wiley.com/doi/10.1111/1471-0528.18355
The Effectiveness of the Patient-Reported Outcomes Measurement Information System ...	https://www.sciencedirect.com/science/article/abs/pii/S0883540325012227
Methodological Study Protocol for The European Atlas of Clinical Trials in Cancer and Haematology	https://www.frontiersin.org/journals/pharmacology/articles/10.3389/fphar.2025.1558556/full
Patient-reported outcomes and functional recovery after carpal tunnel surgery in a ... - Nature	https://www.nature.com/articles/s41598-025-16058-6
The Impact of Age on Patient Reported Outcome Measures after Posterior Cervical ...	https://firstwordpharma.com/story/6095223
